영화코드,영화제목,제작년도,개봉일,상영타입코드,감독,국적,배급사,네이버프리뷰
20210135,바바 야가 검은 가시 마녀,2020,2021-10-05,20210135D(디지털),이반 미닌,러시아,(주)씨네마블랙,"'<b>바바 야가 검은 가시 마녀</b> 감독 이반 미닌 출연 미등록 개봉 2021. 10. 05. 안녕하세요 【 영화 】... 지역 주민들은 가시 나무숲에 과거 잔혹하게 살해당한 검은 가시 마녀의 저주라고 믿고 있다. 2017년 10월 14일... ', '제 목 : <b>바바 야가 검은 가시 마녀</b> (THE WIDOW / Вдова) 감 독 : 이반 미닌 (Ivan Minin) 주 연... 공포영화 &lt;<b>바바 야가</b> : <b>검은 가시 마녀</b>&gt;을 감독한다. 이 영화는 실제 실종된 산림 감시팀의 흔적을 최대한... ', '평점 출연진 예고편 개봉 예정 영화 <b>바바 야가 검은 가시 마녀</b>(Вдова, The Widow, 2020)의 줄거리 및 평점 출연진 정보 An urban legend. A terrifying truth. #서이추환영 #검은가시마녀 #<b>바바야가검은가시마녀</b>', '여러 민담에서, 알라의 외형은 매우 다양하고, 또 애매모호한데, <b>검은</b> 바람, 불분명한 형태의 거대한... 또 알라는 슬라브 민담의 <b>마녀</b>인 <b>바바 야가</b>와 비슷하며, 몇몇 지역에서는 <b>바바 야가</b>와 동일시되기도 한다.... ', '장미는 <b>가시</b> 사이에서 자란다. 한 봉지에 동전 두 개가 들어 있으면 백 개보다 더 시끄럽다. 학자들의 경쟁은 과학을 발전시킨다. 진실은 무겁기 때문에 그것을 운반하는 사람은 거의 없다. 인간에게 사랑받는... ', '197 <b>가시</b>장미 그림 형제 203 이반 왕자, 불새, 회색 늑대 알렉산드르 N. 아파나셰프 208 베네치아 총독의... 404 <b>마녀</b> <b>바바 야가</b>와 아름다운 바실리사 알렉산드르 N. 아파나셰프 409 죽음의 신을 놀린 노파... ', '귀신의 <b>검은</b> 피 연구를 위해 사무전 양호 교사로 잠입했으며 전야제 때 귀신을 부활시킨다. 자신의... 슈타인에 의해서 전야제 때 사망했지만 어린 소녀 레이첼의 몸을 빼앗아 다시 부활, <b>바바 야가</b> 성 전투... ', '<b>마녀</b>는 세가지 궂은 일을 바실리사에게 시키지만 그때마다 목각 인형의 도움으로 난관을 해결했다. 주어진 일들을 모두 마친 바실리사는 <b>바바야가</b>에게 자기가 오두막으로 향하면서 본 <b>검은</b> 기사, 붉은 기사... ', '197 <b>가시</b>장미 그림 형제 203 이반 왕자, 불새, 회색 늑대 알렉산드르 N. 아파나셰프 208 베네치아... 404 <b>마녀</b> <b>바바 야가</b>와 아름다운 바실리사 알렉산드르 N. 아파나셰프 409 죽음의 신을 놀린 노파 이야기... ', '3)баба яга <b>바바 야가</b> (<b>마녀</b> 할머니) <b>바바 야가</b>는 슬라브 신화에서 기형적으로나 흉포하게... 빅토르 바스네쵸프(Viktor Vasnetsov)의 그림 ‘세 명의 무사Bogatyrs’ 중 창을 들고 <b>검은</b> 말에 타고 있는... '<b>바바 야가 검은 가시 마녀</b> 감독 이반 미닌 출연 미등록 개봉 2021. 10. 05. 안녕하세요 【 영화 】... 지역 주민들은 가시 나무숲에 과거 잔혹하게 살해당한 검은 가시 마녀의 저주라고 믿고 있다. 2017년 10월 14일... 제 목 : <b>바바 야가 검은 가시 마녀</b> (THE WIDOW / Вдова) 감 독 : 이반 미닌 (Ivan Minin) 주 연... 공포영화 &lt;<b>바바 야가</b> : <b>검은 가시 마녀</b>&gt;을 감독한다. 이 영화는 실제 실종된 산림 감시팀의 흔적을 최대한... 평점 출연진 예고편 개봉 예정 영화 <b>바바 야가 검은 가시 마녀</b>(Вдова, The Widow, 2020)의 줄거리 및 평점 출연진 정보 An urban legend. A terrifying truth. #서이추환영 #검은가시마녀 #<b>바바야가검은가시마녀</b>여러 민담에서, 알라의 외형은 매우 다양하고, 또 애매모호한데, <b>검은</b> 바람, 불분명한 형태의 거대한... 또 알라는 슬라브 민담의 <b>마녀</b>인 <b>바바 야가</b>와 비슷하며, 몇몇 지역에서는 <b>바바 야가</b>와 동일시되기도 한다.... 장미는 <b>가시</b> 사이에서 자란다. 한 봉지에 동전 두 개가 들어 있으면 백 개보다 더 시끄럽다. 학자들의 경쟁은 과학을 발전시킨다. 진실은 무겁기 때문에 그것을 운반하는 사람은 거의 없다. 인간에게 사랑받는... 197 <b>가시</b>장미 그림 형제 203 이반 왕자, 불새, 회색 늑대 알렉산드르 N. 아파나셰프 208 베네치아 총독의... 404 <b>마녀</b> <b>바바 야가</b>와 아름다운 바실리사 알렉산드르 N. 아파나셰프 409 죽음의 신을 놀린 노파... 귀신의 <b>검은</b> 피 연구를 위해 사무전 양호 교사로 잠입했으며 전야제 때 귀신을 부활시킨다. 자신의... 슈타인에 의해서 전야제 때 사망했지만 어린 소녀 레이첼의 몸을 빼앗아 다시 부활, <b>바바 야가</b> 성 전투... <b>마녀</b>는 세가지 궂은 일을 바실리사에게 시키지만 그때마다 목각 인형의 도움으로 난관을 해결했다. 주어진 일들을 모두 마친 바실리사는 <b>바바야가</b>에게 자기가 오두막으로 향하면서 본 <b>검은</b> 기사, 붉은 기사... 197 <b>가시</b>장미 그림 형제 203 이반 왕자, 불새, 회색 늑대 알렉산드르 N. 아파나셰프 208 베네치아... 404 <b>마녀</b> <b>바바 야가</b>와 아름다운 바실리사 알렉산드르 N. 아파나셰프 409 죽음의 신을 놀린 노파 이야기... 3)баба яга <b>바바 야가</b> (<b>마녀</b> 할머니) <b>바바 야가</b>는 슬라브 신화에서 기형적으로나 흉포하게... 빅토르 바스네쵸프(Viktor Vasnetsov)의 그림 ‘세 명의 무사Bogatyrs’ 중 창을 들고 <b>검은</b> 말에 타고 있는... "
20210168,F20,2021,2021-10-06,20210168D(디지털),홍은미,한국,와이드 릴리즈(주),"'그러다가 이미 맛을 알게된 BMW 중고도 같이 알아보게 되었는데, 딱 118D <b>F20</b> 바디가 눈에 들어왔습니다.... (물론 계속 해서 BMW를 몰아본 분들은 이 <b>F20</b>도 시장에 많이 타협해서 나온 차량이라고는 합니다만..)... ', 'BMW <b>F20</b> 118D 작업내역 : 엑사엔진오일 교환 BMW <b>F20</b> 118D 차량이 입고되었습니다 엔진오일 교환을 위해 부산수입차정비 코리언모터스를 찾아주셨습니다 차량의 보닛을 오픈하고 기본 점검을 한 후 엔진오일 교환... ', 'BMW <b>F20</b> 118D 자바라교환 오늘 작업할 118D 입니다. 저알피엠에서 발생하는 쇠떠는 소음으로... BMW <b>F20</b> 118D 자바라작업 가접을 하고 다시 탈거후 꼼꼼하게 용접을 합니다. 이렇게 작업을 해야 배기라인이... ', '이 손님은 서비스센터를 방문했지만 <b>F20</b> 자재가 미결되어 작업이 당장 불가했던 경우입니다. 물품 도착이 한 달 정도 걸린다며 저희 쪽에 견적 문의를 주셨어요. 아무래도 이 부분은 외제 카를 운전하시는... ', 'BMW 118d <b>F20</b> - 서모스탯, 워터펌프 누수, 브레이크 오일 교환/하남 수입차 정비 엘투개러지 반갑습니다 L2개러지 입니다! 브레이크 오일 교환으로 방문해 주신 BMW 118d <b>F20</b> 모델 B47 엔진 차주님!! 브레이크 오일... ', ""오늘은 10월 개봉 예정 영화 &lt;<b>F20</b>&gt; 예매권 이벤트를 준비해왔습니다. 많은 관심과 참여 부탁드립니다.... 20매) &lt;<b>F20</b>&gt; 영화 정보 &lt;<b>F20</b>&gt;은 아들의 조현병을 숨기고픈 엄마 '애란'(장영남)의 아파트에 같은 병을 앓고... "", '워낙 차량이 작고 엔진이나 밋션에 의해 실내공간이 작아진 <b>F20</b> 120D도 마찬가지겠지요. 그래서 저에게 가장 편한 드라이빙 포지션을 만들어 주는 녀석을 다시 소환하기로 합니다. 예.. 바로 버킷시트가... ', '#삼군개러지 #일산bmw정비 #118d엔진오일 #118d브레이크패드 #118d정비 #일산수입차정비 #삼군 #라이맥스엔진오일 #5w30엔진오일 #일산엔진오일교환 #일산정비 #bmw정비 #bmw118d #브레이크패드센서 bmw <b>f20</b> 118d... ', 'BMW <b>F20</b> 118D 야코 VX1000LE 5W30 합성 엔진오일 교환 온게러지 하이레이싱 세라믹 브레이크패드 교환 안녕하세요. 온게러지입니다. 엔진오일, 브레이크 패드를 교환할 차량은 BMW <b>F20</b> 118D 차량입니다.... ', '영화 제목은 <b>F20</b>입니다. 영화 <b>F20</b> 조현병 영화! 예고편 영상 &amp; 개봉일부터 시작해 보겠습니다. 메인 예고편 영상 &amp; 30초 예고편 영상 https://tv.naver.com/v/22388637 https://tv.naver.com/v/22577651 &quot;엄마가 정말로 무서운 게 뭔... '그러다가 이미 맛을 알게된 BMW 중고도 같이 알아보게 되었는데, 딱 118D <b>F20</b> 바디가 눈에 들어왔습니다.... (물론 계속 해서 BMW를 몰아본 분들은 이 <b>F20</b>도 시장에 많이 타협해서 나온 차량이라고는 합니다만..)... 저는 오전에 받았는데 바뀐 날짜가 사정상 어려워서 다시 변경하느라 바빴네요^^ 차종 : BMW <b>F20</b> 118D 작업내역 : 프론트 브레이크 패드, 브레이크 오일 교환 BMW 118D 차량이 입고되었습니다 프론트 브레이크... BMW <b>F20</b> 118D 자바라교환 오늘 작업할 118D 입니다. 저알피엠에서 발생하는 쇠떠는 소음으로... BMW <b>F20</b> 118D 자바라작업 가접을 하고 다시 탈거후 꼼꼼하게 용접을 합니다. 이렇게 작업을 해야 배기라인이... 이 손님은 서비스센터를 방문했지만 <b>F20</b> 자재가 미결되어 작업이 당장 불가했던 경우입니다. 물품 도착이 한 달 정도 걸린다며 저희 쪽에 견적 문의를 주셨어요. 아무래도 이 부분은 외제 카를 운전하시는... <b>F20</b> - 엔진+미션+디퍼렌셜 오일, 댐퍼풀리, 드라이브 벨트, 연료필터 교환 엘투개러지 안녕하세요 엘투개러지 입니다!! 11만 킬로 도달로 각종 메인터넌스 교환으로 저희 매장을 찾아주셨습니다^^ 차량은 bmw <b>F20</b>... 오늘은 10월 개봉 예정 영화 &lt;<b>F20</b>&gt; 예매권 이벤트를 준비해왔습니다. 많은 관심과 참여 부탁드립니다.... 20매) &lt;<b>F20</b>&gt; 영화 정보 &lt;<b>F20</b>&gt;은 아들의 조현병을 숨기고픈 엄마 '애란'(장영남)의 아파트에 같은 병을 앓고... 워낙 차량이 작고 엔진이나 밋션에 의해 실내공간이 작아진 <b>F20</b> 120D도 마찬가지겠지요. 그래서 저에게 가장 편한 드라이빙 포지션을 만들어 주는 녀석을 다시 소환하기로 합니다. 예.. 바로 버킷시트가... #삼군개러지 #일산bmw정비 #118d엔진오일 #118d브레이크패드 #118d정비 #일산수입차정비 #삼군 #라이맥스엔진오일 #5w30엔진오일 #일산엔진오일교환 #일산정비 #bmw정비 #bmw118d #브레이크패드센서 bmw <b>f20</b> 118d... BMW <b>F20</b> 118D 야코 VX1000LE 5W30 합성 엔진오일 교환 온게러지 하이레이싱 세라믹 브레이크패드 교환 안녕하세요. 온게러지입니다. 엔진오일, 브레이크 패드를 교환할 차량은 BMW <b>F20</b> 118D 차량입니다.... 안녕하세요 정비사S 입니다 오늘 했던 따끈 따끈 한 작업 내용 올려봅니다 차량은 BMW <b>F20</b> 118d 입니다 브레이크 경고등 및 엔진오일 교체를 위해 입고 되었구요 먼저 엔진오일 부터 작업을 시작 합니다.... "
20210142,스틸워터,2021,2021-10-06,20210142D(디지털),토마스 맥카시,미국,씨제이 씨지브이(CJ CGV)(주),"""그래서 <b>스틸워터</b>는 스틸과 워터로 다시금 들리게 된다. 과연 아직도 잔잔한 물의 마을인가. **아비게일 브레스린은 '미스 리틀 선샤인'의 그녀다. 지금 마야의 위치에 있었던 캐릭터다. 그래서 더 캐스팅 된... "", '<b>스틸워터</b>의 이야기는 영화를 위해 쓰인 각본을 토대로 하지만 마치 소설 원작이 있는 것처럼 느껴진다.... 아만다 녹스는 <b>스틸워터</b>가 본인의 처지를 악의적으로 그렸다며 불쾌함을 드러냈지만, 사실 영화는... ', '내 기억으론 처음 아버지 역을 맡은 맷 데이먼 주연의 &lt;<b>스틸워터</b>&gt;이다. 딸의 무죄를 증명하기 위해 직접... 영화 &lt;<b>스틸워터</b>&gt;에 주목하길 바란다. tag : <b>스틸워터</b> , 미국영화 , 드라마영화 , 맷데이먼... ', '#<b>스틸워터</b> #<b>스틸워터</b>시사회 #<b>스틸워터</b>후기 간만에 보는 거 같은 #맷데이먼 을 그냥 지나칠 수 없었다.... 그리고 스틸컷에는 없는데 영화에서 인상 깊은 장면중 하나는 딸이 물에 둥둥 떠다니는 장면이 물속에서... ', '1점 영화 &lt;<b>스틸워터</b>&gt;는 친구를 살해한 혐의로 교도소에 수감된 딸의 누명을 벗기기 위해 진실을... 영화 &lt;<b>스틸워터</b>&gt;는 미국 3대 일간지 중 하나인 보스턴 글로브가 가톨릭 보스턴 교구 사제들의 아동... ', '<b>스틸워터</b> 감독 토마스 맥카시 출연 맷 데이먼, 아비게일 브레스린 개봉 Invalid date 정말 오랜만에 친구와 시사회를 다녀왔다. 내 기억으론 처음 아버지 역을 맡은 맷 데이먼 주연의 &lt;<b>스틸워터</b>&gt;이다. 딸의 무죄를... ', ""오클라호마주 <b>스틸워터</b>에서 살고 있는 석유 시추공 '빌 베이커' 싱글대디인 그는 외동딸 '알리슨'을 만나기 위해 비행기를 타는데 목적지는 프랑스 마르세이유였네요. 영화 &lt;<b>스틸워터</b>, Stillwater&gt; 입니다. 머나먼... "", ""영화제목 '<b>스틸워터</b>'는 가스가 없는 물이 아니라, 오클라호마의 마을 이름이다. 찾아보니 미네소타에도 '<b>스틸워터</b>'라는 도시가 있다. 6. 엔딩크레딧까지 다 보고 극장을 나왔는데, OST에 PSY의 '강남스타일'이... "", ""출처: 다음 영화 '<b>스틸 워터</b>' <b>스틸워터</b> 감독 토마스 맥카시 출연 맷 데이먼, 아비게일 브레스린 개봉 미국 평점 리뷰보기 아직 개봉 전 영화로 스포가 될 수 있습니다. 출연 배우나 영화를 기다리고 계신... "", '영화 제목은 <b>스틸워터</b>입니다. <b>스틸워터</b> 실화, 메인 예고편 영상 소개부터 시작해 보겠습니다. 영화 <b>스틸워터</b> 실화? 영화 <b>스틸워터</b> 실화를 바탕으로 만든 영화라고 하는데요. 바로 2007년도 전 세계를... '그래서 <b>스틸워터</b>는 스틸과 워터로 다시금 들리게 된다. 과연 아직도 잔잔한 물의 마을인가. **아비게일 브레스린은 '미스 리틀 선샤인'의 그녀다. 지금 마야의 위치에 있었던 캐릭터다. 그래서 더 캐스팅 된... 바로 &lt;<b>스틸워터</b>&gt;랍니다! <b>스틸워터</b>는 2021년 10월 6일 개봉을 앞두고 있어요 그렇다면 다 같이 영화에 대해 알아보실까요?? 개봉 2021.10.06. 등급 15세 관람가 장르 드라마 국가 미국 러닝타임 138분 배급 CJ CGV 이... <b>스틸워터</b>의 이야기는 영화를 위해 쓰인 각본을 토대로 하지만 마치 소설 원작이 있는 것처럼 느껴진다.... 아만다 녹스는 <b>스틸워터</b>가 본인의 처지를 악의적으로 그렸다며 불쾌함을 드러냈지만, 사실 영화는... #<b>스틸워터</b> #<b>스틸워터</b>시사회 #<b>스틸워터</b>후기 간만에 보는 거 같은 #맷데이먼 을 그냥 지나칠 수 없었다.... 그리고 스틸컷에는 없는데 영화에서 인상 깊은 장면중 하나는 딸이 물에 둥둥 떠다니는 장면이 물속에서... 1점 영화 &lt;<b>스틸워터</b>&gt;는 친구를 살해한 혐의로 교도소에 수감된 딸의 누명을 벗기기 위해 진실을... 영화 &lt;<b>스틸워터</b>&gt;는 미국 3대 일간지 중 하나인 보스턴 글로브가 가톨릭 보스턴 교구 사제들의 아동... 내 기억으론 처음 아버지 역을 맡은 맷 데이먼 주연의 &lt;<b>스틸워터</b>&gt;이다. 딸의 무죄를 증명하기 위해 직접... 영화 &lt;<b>스틸워터</b>&gt;에 주목하길 바란다. tag : <b>스틸워터</b> , 미국영화 , 드라마영화 , 맷데이먼... 영화 &lt;<b>스틸워터</b>&gt; 스틸컷 드디어 만난 딸은 변호사에게 편지를 전해달라고 간곡히 부탁했다. 해줄 수 있는 게 없는 아버지는 어렵사리 변호사를 만나지만 5년 전 종결된 사건이라 재심이 어렵다는 성의 없는... 오클라호마주 <b>스틸워터</b>에서 살고 있는 석유 시추공 '빌 베이커' 싱글대디인 그는 외동딸 '알리슨'을 만나기 위해 비행기를 타는데 목적지는 프랑스 마르세이유였네요. 영화 &lt;<b>스틸워터</b>, Stillwater&gt; 입니다. 머나먼... <b>스틸워터</b> 감독 토마스 맥카시 출연 맷 데이먼, 아비게일 브레스린 개봉 Invalid date 정말 오랜만에 친구와 시사회를 다녀왔다. 내 기억으론 처음 아버지 역을 맡은 맷 데이먼 주연의 &lt;<b>스틸워터</b>&gt;이다. 딸의 무죄를... 영화제목 '<b>스틸워터</b>'는 가스가 없는 물이 아니라, 오클라호마의 마을 이름이다. 찾아보니 미네소타에도 '<b>스틸워터</b>'라는 도시가 있다. 6. 엔딩크레딧까지 다 보고 극장을 나왔는데, OST에 PSY의 '강남스타일'이... "
20191503,화이트데이: 부서진 결계,2021,2021-10-06,20191503D(디지털),송운,한국,(주)제이앤씨미디어그룹,"'미궁에 빠진 학교를 구하라 &lt;<b>화이트데이: 부서진 결계</b>&gt; 먼저 전설적인 공포 게임 ‘화이트데이... 젠데이아 등 할리우드 대표 배우들의 총집합을 예고하며 일찍부터 큰 기대를 낳고 있다. (2021년 10월 20일 개봉... ', '&lt;<b>화이트데이: 부서진 결계</b>&gt;는 늦은 밤 학교에서 일어나는 기이한 현상을 일으키는 악령으로부터 친구들을 구하기 위한 사투를 그린 공포 판타지 영화. 공개된 보도스틸은 결계가 부서진 학교에서 벌어질... ', '<b>화이트데이</b> 실사 영화 <b>부서진 결계</b> 메인 예고편이 드디어 공개 <b>화이트데이</b> <b>부서진 결계</b> 2021년 10월 6일 대개봉 소오름 강찬희 박유나 주연 퇴마사 장광 선생님까지 어둠이 깃든 땅을 학생들의 맑은... ', '<b>화이트데이: 부서진 결계</b> 메인 예고편 출처: CGV 공식 페이스북 ▲ <b>화이트데이: 부서진 결계</b> 영화의 주인공 이희민(강찬희)은 학교 옥상 난간에 서서 자살 기도를 하는 것으로 보이는 여학생을 목격합니다.... ', ""영화 '<b>화이트데이 : 부서진 결계</b>' 런칭 예고편 나옴 우선 촌스럽고 논란 있던 '귀멸의 퇴마학교' 라는 부제 떼어내고 '부서진 결계'로 바꿈. 근본 여주인공 '한소영' 나옴. 2001년판은 이름 변경 가능하지만 근본... "", ""<b>화이트데이: 부서진 결계</b> The Labyrinth 영화 &lt;<b>화이트데이: 부서진 결계</b>&gt;의 메인 예고편입니다. 우선, 제가 예상했던 부분이 틀렸네요. '장광' 아저씨가 수위로 등장할 줄 알았는데. 무려 퇴마사로 등장합니다.... "", '레전드 호러게임 원작 국산 호러 게임 [ 화이트데이: 학교라는 이름의 미궁] 을 원작으로 하여, 퇴마소재를 결합시킨 영화, &quot;<b>화이트데이:부서진 결계</b>&quot;가 개봉을 예고하며 공포스런 예고영상을 공개했습니다. 이... ', ""게임 '화이트데이: 학교라는 이름의 미궁'을 원작으로한, 늦은 밤 학교에서 일어나는 기이한 현상을 일으키는 악령으로부터 친구들을 구하기 위한 사투를 그린 공포 판타지 영화 &lt;<b>화이트데이: 부서진 결계</b>&gt;가... "", ""두 번째 부제인 부서진 결계도 엉성한 느낌이었는데, 아니나 다를까... 총체적 난국의 개판으로... com/entertain/movie/article/076/0003777375 [스포츠조선 이승미 기자]송운 감독이 영화 '<b>화이트데이: 부서진 결계</b>'에... "", "":) 영화 &lt;<b>화이트 데이: 부서진 결계</b>&gt;의 장면 이걸 어떻게 설명해야할까요... 일단, 영화에 앞서 게임을 소개하자면 원작이 되는 게임 &lt;화이트 데이: 학교라는 이름의 미궁&gt;은 1개의 엔딩이 아닌 '멀티 엔딩'을 가진... ""미궁에 빠진 학교를 구하라 &lt;<b>화이트데이: 부서진 결계</b>&gt; 먼저 전설적인 공포 게임 ‘화이트데이... 젠데이아 등 할리우드 대표 배우들의 총집합을 예고하며 일찍부터 큰 기대를 낳고 있다. (2021년 10월 20일 개봉... &lt;<b>화이트데이: 부서진 결계</b>&gt;는 늦은 밤 학교에서 일어나는 기이한 현상을 일으키는 악령으로부터 친구들을 구하기 위한 사투를 그린 공포 판타지 영화. 공개된 보도스틸은 결계가 부서진 학교에서 벌어질... <b>화이트데이: 부서진 결계</b> 메인 예고편 출처: CGV 공식 페이스북 ▲ <b>화이트데이: 부서진 결계</b> 영화의 주인공 이희민(강찬희)은 학교 옥상 난간에 서서 자살 기도를 하는 것으로 보이는 여학생을 목격합니다.... <b>화이트데이</b> 실사 영화 <b>부서진 결계</b> 메인 예고편이 드디어 공개 <b>화이트데이</b> <b>부서진 결계</b> 2021년 10월 6일 대개봉 소오름 강찬희 박유나 주연 퇴마사 장광 선생님까지 어둠이 깃든 땅을 학생들의 맑은... 영화 '<b>화이트데이 : 부서진 결계</b>' 런칭 예고편 나옴 우선 촌스럽고 논란 있던 '귀멸의 퇴마학교' 라는 부제 떼어내고 '부서진 결계'로 바꿈. 근본 여주인공 '한소영' 나옴. 2001년판은 이름 변경 가능하지만 근본... <b>화이트데이: 부서진 결계</b> The Labyrinth 영화 &lt;<b>화이트데이: 부서진 결계</b>&gt;의 메인 예고편입니다. 우선, 제가 예상했던 부분이 틀렸네요. '장광' 아저씨가 수위로 등장할 줄 알았는데. 무려 퇴마사로 등장합니다.... 레전드 호러게임 원작 국산 호러 게임 [ 화이트데이: 학교라는 이름의 미궁] 을 원작으로 하여, 퇴마소재를 결합시킨 영화, &quot;<b>화이트데이:부서진 결계</b>&quot;가 개봉을 예고하며 공포스런 예고영상을 공개했습니다. 이... 게임 '화이트데이: 학교라는 이름의 미궁'을 원작으로한, 늦은 밤 학교에서 일어나는 기이한 현상을 일으키는 악령으로부터 친구들을 구하기 위한 사투를 그린 공포 판타지 영화 &lt;<b>화이트데이: 부서진 결계</b>&gt;가... 두 번째 부제인 부서진 결계도 엉성한 느낌이었는데, 아니나 다를까... 총체적 난국의 개판으로... com/entertain/movie/article/076/0003777375 [스포츠조선 이승미 기자]송운 감독이 영화 '<b>화이트데이: 부서진 결계</b>'에... :) 영화 &lt;<b>화이트 데이: 부서진 결계</b>&gt;의 장면 이걸 어떻게 설명해야할까요... 일단, 영화에 앞서 게임을 소개하자면 원작이 되는 게임 &lt;화이트 데이: 학교라는 이름의 미궁&gt;은 1개의 엔딩이 아닌 '멀티 엔딩'을 가진... "
