영화코드,영화제목,제작년도,개봉일,상영타입코드,감독,국적,배급사,네이버프리뷰
20218500,졸트,2021,2021-10-14,20218500D(디지털),타니아 웩슬러,미국,(주)제이앤씨미디어그룹,"'Jolt <b>졸트</b> 정보 출연진 케이트 베킨세일 (린디) 스탠리 투치 (닥터 프로이트) 제이 코트니 (저스틴) 바비 카나베일 (비카스 형사) 래번 콕스 (네빈 여형사) 목소리가 이상해서 찾아 보니 역시나 트랜스젠더다. #<b>졸트</b>... ', '카니지&gt;, &lt;<b>졸트</b>&gt;, &lt;듄&gt; 등 화려한 라인업으로 무장한 10월 개봉작 라인업이 화제를 모으고 있다. 10월 6일... 선사할 &lt;<b>졸트</b>&gt;, 초특급 라인업으로 화제를 모으고 있는 &lt;듄&gt; 등 매주 극장가를 들썩이게 만들 화려한... ', '▶ 소문의 시작 &lt;<b>졸트</b>&gt; 2021 (연출 : 타니아 웩슬러 / 출연 : 케이트 베킨세일, 스탠리 투치) 사랑하는 남친을 잃은 그녀. 더 이상의 통제는 필요 없다. 제대로 돌아버린 자. 그녀의 숨은 능력이 깨어난다! 백만... ', ""<b>졸트</b>(Jolt, 2021) 10월에 개봉하는 영화 중에서 오랜만에 반가운 배우 한 명이 눈에 보이더군요, &lt;언더월드&gt; 시리즈로 유명한 '케이트 베킨세일'의 액션 영화 &lt;<b>졸트</b>&gt;입니다. 아마존 프라임 오리지널 영화 &lt;<b>졸트</b>&gt; 영화... "", '2편 영화의 병풍 역활이자 폴른을 막을 수 있게 해준 일등공신 <b>졸트</b>! 가격으로 말이 많긴 많아도 정발 속도가 빨라서 일단 바로 질렀습니다 ㅠㅠ 트랜스포머 SS <b>졸트</b> 트랜스포머 : 리벤지 오브 더 폴른 와! 드디어... ', '시커 <b>졸트</b>기능을 가지고 있어서 사용하기 편리합니다. 무엇보다 요즘 소비자들이 중요하게 생각하는... 시커 <b>졸트</b>기능은 약 800회를 사용할 수 있습니다. 실제적으로 필드에서 사용환경을 보면, 티 박스에서 1... ', ""아마존 프라임의 영화 '<b>졸트</b>(JOLT)' 후기입니다. 개인적으로 <b>졸트</b>라고 하니 괜히 안젤리나 졸리가 연상이 되는 영화이기도 한데요. 여성 주인공이 까부수는? 면에 있어서는 졸리의 액션 영화를 생각나게도... "", '<b>졸트</b> Jolt 미국 / 액션, 코미디 / 2021 영화 정보 아마존 오리지널 무비 감독은 타냐 웩슬러라는 여성... 영화 <b>졸트</b>의 줄거리는 어릴적부터 차원이 다른 심각한 분노조절장애가 있어서 평범하게 자라지 못한 주인공... ', '안녕하세요 커비입니다 :) 아마존프라임에서 볼게 뭐 있나 싶어 찾아보니 케이트 베킨세일 주연인 <b>졸트</b>(jolt)가 있었습니다. 예고편도 확인 안하고 그냥 바로 시청했습니다. 진짜 확인해볼걸.. <b>졸트</b> Jolt <b>졸트</b>... ', '영화 <b>졸트</b> Jolt 후기, 쿠키영상 / 케이트 베킨세일, 아마존 프라임 여행자제이 &lt;스포일러가 있습니다... <b>졸트</b> 평점 6.5 (작품 6, 재미 7) 예고편 이미지 준비중 <b>졸트</b> 감독 타니아 웩슬러 출연 케이트 베킨세일, 제이... 'Jolt <b>졸트</b> 정보 출연진 케이트 베킨세일 (린디) 스탠리 투치 (닥터 프로이트) 제이 코트니 (저스틴) 바비 카나베일 (비카스 형사) 래번 콕스 (네빈 여형사) 목소리가 이상해서 찾아 보니 역시나 트랜스젠더다. #<b>졸트</b>... 있는 &lt;<b>졸트</b>&gt;가 극강의 카타르시스를 선사하는 메인 예고편을 공개해 화제다. &lt;<b>졸트</b>&gt;는 사랑하는 남친을 잃은 그녀가 숨겨왔던 특별한 능력을 꺼내 통제 불가 짜릿한 복수에 나서는 액션 영화. 공개된 메인... 카니지&gt;, &lt;<b>졸트</b>&gt;, &lt;듄&gt; 등 화려한 라인업으로 무장한 10월 개봉작 라인업이 화제를 모으고 있다. 10월 6일... 선사할 &lt;<b>졸트</b>&gt;, 초특급 라인업으로 화제를 모으고 있는 &lt;듄&gt; 등 매주 극장가를 들썩이게 만들 화려한... ▶ 소문의 시작 &lt;<b>졸트</b>&gt; 2021 (연출 : 타니아 웩슬러 / 출연 : 케이트 베킨세일, 스탠리 투치) 사랑하는 남친을 잃은 그녀. 더 이상의 통제는 필요 없다. 제대로 돌아버린 자. 그녀의 숨은 능력이 깨어난다! 백만... <b>졸트</b>(Jolt, 2021) 10월에 개봉하는 영화 중에서 오랜만에 반가운 배우 한 명이 눈에 보이더군요, &lt;언더월드&gt; 시리즈로 유명한 '케이트 베킨세일'의 액션 영화 &lt;<b>졸트</b>&gt;입니다. 아마존 프라임 오리지널 영화 &lt;<b>졸트</b>&gt; 영화... 시커 <b>졸트</b>기능을 가지고 있어서 사용하기 편리합니다. 무엇보다 요즘 소비자들이 중요하게 생각하는... 시커 <b>졸트</b>기능은 약 800회를 사용할 수 있습니다. 실제적으로 필드에서 사용환경을 보면, 티 박스에서 1... 2편 영화의 병풍 역활이자 폴른을 막을 수 있게 해준 일등공신 <b>졸트</b>! 가격으로 말이 많긴 많아도 정발 속도가 빨라서 일단 바로 질렀습니다 ㅠㅠ 트랜스포머 SS <b>졸트</b> 트랜스포머 : 리벤지 오브 더 폴른 와! 드디어... 아마존 프라임의 영화 '<b>졸트</b>(JOLT)' 후기입니다. 개인적으로 <b>졸트</b>라고 하니 괜히 안젤리나 졸리가 연상이 되는 영화이기도 한데요. 여성 주인공이 까부수는? 면에 있어서는 졸리의 액션 영화를 생각나게도... <b>졸트</b> Jolt 미국 / 액션, 코미디 / 2021 영화 정보 아마존 오리지널 무비 감독은 타냐 웩슬러라는 여성... 영화 <b>졸트</b>의 줄거리는 어릴적부터 차원이 다른 심각한 분노조절장애가 있어서 평범하게 자라지 못한 주인공... 안녕하세요 커비입니다 :) 아마존프라임에서 볼게 뭐 있나 싶어 찾아보니 케이트 베킨세일 주연인 <b>졸트</b>(jolt)가 있었습니다. 예고편도 확인 안하고 그냥 바로 시청했습니다. 진짜 확인해볼걸.. <b>졸트</b> Jolt <b>졸트</b>... "
20210173,킬링 오브 투 러버스,2020,2021-10-14,20210173D(디지털),-,캐나다,(주)영화특별시에스엠씨,"'올린 &lt;<b>킬링 오브 투 러버스</b>&gt;는 &lt;더 마이너스&gt;(2018)를 통해 성공적인 협업을 보여준 로버트 맥호이안... 점은 &lt;<b>킬링 오브 투 러버스</b>&gt;의 놓쳐서는 안 될 관람 포인트. 뿐만 아니라, 감독은 “와이드샷으로 찍은... ', '영화 [<b>킬링 오브 투 러버스</b>] 메인 예고편(한글) : 클레인 크로포드 : 2021.10 : 로맨스 ‘니키’와 서로 다른 사람을 만나는 것에 동의하고 별거 중인 ‘데이빗’은 우연히 아내의 연인 ‘데릭’의... ', ""<b>킬링 오브 투 러버스</b> 장르: 멜로, 로맨스/미국 감독: 로버트 맥호이안 출연: 클레인 크로포드, 세피데 모아피, 크리스 코이 2021.10 '<b>킬링 오브 투 러버스</b>'(감독 로버트 맥호이안)는 다수의 단편을 통해... "", 'com/culturebloom/1360247 &lt;<b>킬링 오브 투 러버스</b>&gt; 최초 리뷰어 시사 이벤트 (CGV용산아이파크몰 - 9/30) # 시사 일정 : 9/30 (목) 오후 8시 # 시사 장소 : CGV 용산 아이파크몰 닉네임... ', '<b>킬링 오브 투 러버스</b> 감독 로버트 맥호이안 출연 클레인 크로포드, 크리스 코이, 세피데 모아피 개봉 Invalid date PickMovie :: &lt;<b>킬링 오브 투 러버스</b>&gt; 정보 및 예고편 소개 감독 : 로버트... ', '영화정보 개요 멜로/로맨스ㅣ캐나다ㅣ 84분 연출 로버트 맥호이안 출연 클레인 크로포드, 세피데 모아피, 크리스 코이 영화등급 12세 관람가 ‘니키’와 서로 다른 사람을 만나는 것에 동의하고 별거 중인... ', 'http://tv.naver.com/v/22686943?openType=nmp #<b>킬링오브투러버스</b> 메인 예고편', '', '', ''영화 &lt;<b>킬링 오브 투 러버스</b>&gt; 시사회장에서 영화 시사회 <b>킬링 오브 투 러버스</b> 용산 HDC 아이파크몰에 있는 CGV를 통하여 시사회를 다녀왔는데요 10월에 개봉되는 영화로서 시사회로는 최초라고 합니다 티켓을... 고로 '<b>킬링 오브 투 러버스</b>'는 작은 마을에서 살고 있는 점점 좁아진 부부의 심리적 관계이자 위기를... 아직도 킬링과 투 러버스가 남았기 때문이다. 화면 밖으로 슬그머니 수상한 트럭이 빠져나가듯이. 아직... 올린 &lt;<b>킬링 오브 투 러버스</b>&gt;는 &lt;더 마이너스&gt;(2018)를 통해 성공적인 협업을 보여준 로버트 맥호이안... 점은 &lt;<b>킬링 오브 투 러버스</b>&gt;의 놓쳐서는 안 될 관람 포인트. 뿐만 아니라, 감독은 “와이드샷으로 찍은... 영화 [<b>킬링 오브 투 러버스</b>] 메인 예고편(한글) : 클레인 크로포드 : 2021.10 : 로맨스 ‘니키’와 서로 다른 사람을 만나는 것에 동의하고 별거 중인 ‘데이빗’은 우연히 아내의 연인 ‘데릭’의... &lt;<b>킬링 오브 투 러버스</b>, 2021&gt; The Killing of Two Lovers 미국, 드라마, 84분, 12세 감독 : 로버트 매코이언... 블루라벨픽쳐스 &lt; #<b>킬링오브투러버스</b> 시놉시스&gt; 서로의 마음을 반드시 갖고 싶은 세 연인의 사랑할수록... <b>킬링 오브 투 러버스</b> 장르: 멜로, 로맨스/미국 감독: 로버트 맥호이안 출연: 클레인 크로포드, 세피데 모아피, 크리스 코이 2021.10 '<b>킬링 오브 투 러버스</b>'(감독 로버트 맥호이안)는 다수의 단편을 통해... com/culturebloom/1360247 &lt;<b>킬링 오브 투 러버스</b>&gt; 최초 리뷰어 시사 이벤트 (CGV용산아이파크몰 - 9/30) # 시사 일정 : 9/30 (목) 오후 8시 # 시사 장소 : CGV 용산 아이파크몰 닉네임... <b>킬링 오브 투 러버스</b> 감독 로버트 맥호이안 출연 클레인 크로포드, 크리스 코이, 세피데 모아피 개봉 Invalid date PickMovie :: &lt;<b>킬링 오브 투 러버스</b>&gt; 정보 및 예고편 소개 감독 : 로버트... ‘니키’와 서로 다른 사람을 만나는 것에 동의하고 별거 중인 ‘데이빗’은 우연히 아내의 연인 ‘데릭’의 존재를 알게 된 후 참을 수 없는 분노를 느낀다. 한편, 결혼과 육아로 단절되어버린 꿈을 이루기 위해... 영화정보 개요 멜로/로맨스ㅣ캐나다ㅣ 84분 연출 로버트 맥호이안 출연 클레인 크로포드, 세피데 모아피, 크리스 코이 영화등급 12세 관람가 ‘니키’와 서로 다른 사람을 만나는 것에 동의하고 별거 중인... "
20210575,3대 테너: 영원한 목소리,2020,2021-10-20,"20210575D(디지털)
20210575G(디지털 4K)",장 알렉산더 느티비하브와,독일,(주)케빈앤컴퍼니,"'또한 <b>3대 테너 : 영원한 목소리</b> (Three Tenors: Voices For Eternity)라는 다큐영화로 2020년에 제작되기도 했다.... 또한 ’3대 테너는 서커스이다. 3명의 테너, 3개의 딸랑이였다.‘라고 악평을... 심지어는 ’클래식... ', '이탈리아의 故루치아노·파바로티(Luciano Pavarotti)와 함께 세계<b>3대 테너</b>가수로 불린다. 3명 모두 각각 다른 개성을 지니고 있는 가운데 도밍고는 달콤한 <b>목소리</b>와 드라마틱한 표현이... ', '다양한 <b>목소리</b>를 쓸 수 있도록 많은 도움을 주었죠”라고 말했다. 모린 과의 작업이... 루치아노 파바로티 (Luciano Pavarotti), 호세 까레라스 (Jose Carreras) 등과 세계 <b>3대 테너</b>... ', '맑은 <b>목소리</b>의 모린 맥거번(Maureen McGovern)이 부른 추억의 팝송 <b>영원한</b> 사랑(A Love Until The End Of Time)!! 스페인에서 태어나 1961년에 오페라 <b>테너</b>가수로 데뷔한 ‘플라시도... ', 'A ♥ Until The End Of Time (<b>영원한</b> 사랑) / Placido Domingo &amp; Maureen Mcgovern I love you with a heart... * 이 곡은 세계 <b>3대 테너</b> 중 한 사람인 Placido Domingo의 힘있고 감미로운 <b>목소리</b>와... ', '세계 ‘<b>3대 테너</b>’로 불려온 플라시도 도밍고(왼쪽), 호세 카레라스(가운데), 루치아노 파바로티... 교수는 “<b>목소리</b>의 기술이 가장 완벽한 <b>테너</b>일 뿐만 아니라 굉장히 소탈하고 서민적인 훌륭한 분이었는데... ', '세계<b>3대 테너</b> 플라시도 도밍고가 함께부른 perhaps love는 언제들어도 감미로움을... 노래는 계속해서 사랑을 받고 있지만 안타깝게도 이 곡을 부른 마운팅 씽어 존덴버의 <b>목소리</b>는... ', '맑은 <b>목소리</b>의 모린 맥거번(Maureen McGovern)이 부른 추억의 팝송 A Love Until The End Of Time <b>영원한</b> 사랑!! 1941년 스페인에서 태어나 1961년에 오페라 <b>테너</b>가수로 데뷔한 ‘플라시도... ', '끝날까지 <b>영원한</b> 사랑 루치아노 파바로티, 호세 카레라스와 함께 세계 <b>3대 테너</b> 중의... A Love Until The End Of Time 이 곡은 클래식하고 부드러운 <b>목소리</b>를 가진 플라시도 도밍고와... ', '‘ <b>영원한</b> 사랑 ’, ‘ 사랑은 이세상 끝까지 ’ 등의 제목으로 번역되어 소개되었다 . <b>목소리</b>의 조화는 물론 화음까지 잘 어울려 이주 사랑스럽고 아름다운 곡이다 . 음악듣기 : https... '또한 <b>3대 테너 : 영원한 목소리</b> (Three Tenors: Voices For Eternity)라는 다큐영화로 2020년에 제작되기도 했다.... 또한 ’3대 테너는 서커스이다. 3명의 테너, 3개의 딸랑이였다.‘라고 악평을... 심지어는 ’클래식... 이탈리아의 故루치아노·파바로티(Luciano Pavarotti)와 함께 세계<b>3대 테너</b>가수로 불린다. 3명 모두 각각 다른 개성을 지니고 있는 가운데 도밍고는 달콤한 <b>목소리</b>와 드라마틱한 표현이... 다양한 <b>목소리</b>를 쓸 수 있도록 많은 도움을 주었죠”라고 말했다. 모린 과의 작업이... 루치아노 파바로티 (Luciano Pavarotti), 호세 까레라스 (Jose Carreras) 등과 세계 <b>3대 테너</b>... 맑은 <b>목소리</b>의 모린 맥거번(Maureen McGovern)이 부른 추억의 팝송 <b>영원한</b> 사랑(A Love Until The End Of Time)!! 스페인에서 태어나 1961년에 오페라 <b>테너</b>가수로 데뷔한 ‘플라시도... A ♥ Until The End Of Time (<b>영원한</b> 사랑) / Placido Domingo &amp; Maureen Mcgovern I love you with a heart... * 이 곡은 세계 <b>3대 테너</b> 중 한 사람인 Placido Domingo의 힘있고 감미로운 <b>목소리</b>와... 세계 ‘<b>3대 테너</b>’로 불려온 플라시도 도밍고(왼쪽), 호세 카레라스(가운데), 루치아노 파바로티... 교수는 “<b>목소리</b>의 기술이 가장 완벽한 <b>테너</b>일 뿐만 아니라 굉장히 소탈하고 서민적인 훌륭한 분이었는데... 세계<b>3대 테너</b> 플라시도 도밍고가 함께부른 perhaps love는 언제들어도 감미로움을... 노래는 계속해서 사랑을 받고 있지만 안타깝게도 이 곡을 부른 마운팅 씽어 존덴버의 <b>목소리</b>는... 맑은 <b>목소리</b>의 모린 맥거번(Maureen McGovern)이 부른 추억의 팝송 A Love Until The End Of Time <b>영원한</b> 사랑!! 1941년 스페인에서 태어나 1961년에 오페라 <b>테너</b>가수로 데뷔한 ‘플라시도... 끝날까지 <b>영원한</b> 사랑 루치아노 파바로티, 호세 카레라스와 함께 세계 <b>3대 테너</b> 중의... A Love Until The End Of Time 이 곡은 클래식하고 부드러운 <b>목소리</b>를 가진 플라시도 도밍고와... ‘ <b>영원한</b> 사랑 ’, ‘ 사랑은 이세상 끝까지 ’ 등의 제목으로 번역되어 소개되었다 . <b>목소리</b>의 조화는 물론 화음까지 잘 어울려 이주 사랑스럽고 아름다운 곡이다 . 음악듣기 : https... "
20210489,경고,2020,2021-10-20,20210489D(디지털),-,영국,(주)태양미디어그룹,"'투자<b>경고</b>) #한국비엔씨주가 는 연휴전 49750원으로 마감 3개월 기준 최고가 5만원 3개월 기준 최저가... 그런지 #투자<b>경고</b> 종목이 되었다 왜인지 거래량과 더불어 등락률등을 보면 8월 말만해도 2만원... ', '이러한 주식 투자<b>경고</b>종목이 왜 지정이되는 것이며 매수를 해도 되는 것인지? 어떠한 점을 눈여겨 봐야 하는지 꼼꼼하게 따져보도록 하겠습니다. 알고 매수해야지 투자<b>경고</b>종목이란? 주가가 5일간 75% 또는... ', '한은이 요즘 #부동산시장 #집값전망 이나 <b>경고</b>의 시그널을 계속 보내고 있습니다. 한은의 부동산 집값전망 <b>경고</b> 틀린 이야기는 아닌데 저 정도로 실물경제에 영향을 미친다면 상당히 큰 문제로 갑니다. 어쨌거나... ', '데이터로 알 수 있는 2030년 지구의 <b>경고</b> 저자 후마 겐지 출판 큰그림 발매 2021.09.07. 데이터로 알 수 있는 2030 지구의 <b>경고</b>! 제목만 봐도 내용을 짐작 가능할 만큼 너무 귀에 익은 단어 지구의 <b>경고</b>! 요즘은 책을... ', '공모주 상장 후 주식 VI발동 투자<b>경고</b>종목 지정예고 공모주 상장 후 주식 VI발동 그리고 투자<b>경고</b>종목 지정예고 공모주 투자를 시작하면서 책으로만 읽었던 주식공부 관련 용어들을 직접 경험하면서 배우게... ', '미국 재닛 옐런 재무장관이 미국 부채한도 도달에 따른 디폴트를 <b>경고</b>했다. 결론적으로 미국의... 그에 따라 원화의 가치는 옐런의 <b>경고</b>와 함께 하락세를 보이고 있다. 원화가치 하락으로 환율은 급등하는... ', '또는 오래전부터 서서히 <b>경고</b>를 해주었음에도 우리가 눈치를 채지 못 하고 방치하였을 수도 있죠. 서서히 <b>경고</b>를 해주었으나 우리가 방치하게 된 대표적인 퇴행성 무릎관절염, 무릎인공관절수술을 통해 치료가... ', '과열됐다고 <b>경고</b>했다. 그는 미국 주식 시장이 1929년 대공황과 2000년 닷컴 버블보다도 심각한 거품이... 모른다며 <b>경고</b>를 이어갔다. 밈 주식(온라인 언급으로 급등한 종목), 스팩(기업인수목적회사·SPAC)... ', ""지금 샀다간…&quot; 전문가의 <b>경고</b> 최근 정부는 '도심주택공급 확대 및 아파트 공급속도 제공방안'을 발표했습니다. 요지는 원룸형 아파트인 도시형 생활주택의 기존 전용면적 50㎡ 이하를 60㎡로 완화, 방을... "", '환절기에는 역시 순정 튜닝이죠 쏘나타 DN8 후측방충돌<b>경고</b> 옵션 빠진 차량이 플레이앤드에 입고되어... 후측방 <b>경고</b>등이 없습니다 일반 거울이 끼워져 있어요 해당 부품들이 다 빠져 있습니다. 그래서 먼저... '것이라 <b>경고</b>했다. 현지시각으로 28일, 미국 언론매체의 보도에 따르면 옐런 장관은 민주당과 공화당 의회 지도부에 이같이 강력한 <b>경고</b>성 서한을 보낸 것으로 알려졌다. 옐런 장관은 10월 18일이 되면... 투자<b>경고</b>) #한국비엔씨주가 는 연휴전 49750원으로 마감 3개월 기준 최고가 5만원 3개월 기준 최저가... 그런지 #투자<b>경고</b> 종목이 되었다 왜인지 거래량과 더불어 등락률등을 보면 8월 말만해도 2만원... 데이터로 알 수 있는 2030년 지구의 <b>경고</b> 저자 후마 겐지 출판 큰그림 발매 2021.09.07. 데이터로 알 수 있는 2030 지구의 <b>경고</b>! 제목만 봐도 내용을 짐작 가능할 만큼 너무 귀에 익은 단어 지구의 <b>경고</b>! 요즘은 책을... 뒤에 설명할 투자<b>경고</b>종목 지정 후 2일 간 20% 이상 상승하거나 투자위험종목 지정 후 익일 또는 3일 간... 투자주의종목 / 투자<b>경고</b>종목 / 투자위험종목 주의 → <b>경고</b> → 위험 순으로 더 높은 강도의 <b>경고</b>를... 과열됐다고 <b>경고</b>했다. 그는 미국 주식 시장이 1929년 대공황과 2000년 닷컴 버블보다도 심각한 거품이... 모른다며 <b>경고</b>를 이어갔다. 밈 주식(온라인 언급으로 급등한 종목), 스팩(기업인수목적회사·SPAC)... 지금 샀다간…&quot; 전문가의 <b>경고</b> 최근 정부는 '도심주택공급 확대 및 아파트 공급속도 제공방안'을 발표했습니다. 요지는 원룸형 아파트인 도시형 생활주택의 기존 전용면적 50㎡ 이하를 60㎡로 완화, 방을... 이러한 주식 투자<b>경고</b>종목이 왜 지정이되는 것이며 매수를 해도 되는 것인지? 어떠한 점을 눈여겨 봐야 하는지 꼼꼼하게 따져보도록 하겠습니다. 알고 매수해야지 투자<b>경고</b>종목이란? 주가가 5일간 75% 또는... 미국 재닛 옐런 재무장관이 미국 부채한도 도달에 따른 디폴트를 <b>경고</b>했다. 결론적으로 미국의... 그에 따라 원화의 가치는 옐런의 <b>경고</b>와 함께 하락세를 보이고 있다. 원화가치 하락으로 환율은 급등하는... 공모주 상장 후 주식 VI발동 투자<b>경고</b>종목 지정예고 공모주 상장 후 주식 VI발동 그리고 투자<b>경고</b>종목 지정예고 공모주 투자를 시작하면서 책으로만 읽었던 주식공부 관련 용어들을 직접 경험하면서 배우게... 한은이 요즘 #부동산시장 #집값전망 이나 <b>경고</b>의 시그널을 계속 보내고 있습니다. 한은의 부동산 집값전망 <b>경고</b> 틀린 이야기는 아닌데 저 정도로 실물경제에 영향을 미친다면 상당히 큰 문제로 갑니다. 어쨌거나... "
